{
  "run_complete": true,
  "runner_sha256": "7006a01266912c223984944bed71c836a761ceac811790b351a071e71f464c0c",
  "source_dirty": false,
  "schema_version": 1,
  "execution_kind": "scripted",
  "source_revision": "ee592e1817d027533076d8d9d09e695cbcae868c",
  "source_diff_sha256": "e3b0c44298fc1c149afbf4c8996fb92427ae41e4649b934ca495991b7852b855",
  "generated_at": "2026-09-10T00:29:30Z",
  "go_version": "go1.26.5",
  "platform": "darwin/arm64",
  "browser": {
    "protocolVersion": "1.3",
    "product": "Chrome/152.0.7977.83",
    "revision": "@79460ebecaa5625e57a5fb679a735659e73dc687",
    "userAgent": "Mozilla/5.0 (Macintosh; Intel Mac OS X 10_15_7) AppleWebKit/537.36 (KHTML, like Gecko) HeadlessChrome/152.0.0.0 Safari/537.36",
    "jsVersion": "15.2.124.21"
  },
  "fixture_sha256": {
    ".sightmap/app.yaml": "729568404b46da1c833ae7fce0a531a21f379237ae326ee7a8cfc0bb2a60b2b2",
    "index.html": "29f91345e62ac2a695fc938802b0bf72fdba62af68fab4b34331d338f3f02074"
  },
  "tasks": [
    {
      "ID": "save-contact",
      "Prompt": "Save a contact named Ada.",
      "Assert": "document.querySelector('#saved').textContent === 'Saved: Ada'",
      "Actions": [
        "document.querySelector('#name').value='Ada'; document.querySelector('#name').dispatchEvent(new Event('input',{bubbles:true})); true",
        "document.querySelector('#contact button').click(); true"
      ]
    },
    {
      "ID": "filter-select",
      "Prompt": "Filter the directory to Grace and select her.",
      "Assert": "document.querySelector('#selected').textContent === 'Selected: Grace' \u0026\u0026 document.querySelector('[data-key=\"Ada\"]').hidden \u0026\u0026 !document.querySelector('[data-key=\"Grace\"]').hidden",
      "Actions": [
        "document.querySelector('#filter').value='Grace'; document.querySelector('#filter').dispatchEvent(new Event('input',{bubbles:true})); true",
        "document.querySelector('[data-person=\"Grace\"]').click(); true"
      ]
    },
    {
      "ID": "open-report",
      "Prompt": "Open the report and find the quarter total.",
      "Assert": "location.hash === '#report' \u0026\u0026 !document.querySelector('#report').hidden \u0026\u0026 document.querySelector('#report').textContent === 'Quarter total: 42'",
      "Actions": [
        "document.querySelector('a').click(); new Promise(resolve =\u003e setTimeout(() =\u003e resolve(true), 20))"
      ]
    }
  ],
  "cells": [
    {
      "task": "save-contact",
      "mode": "raw-ax",
      "repetition": 1,
      "status": "completed",
      "scripted_assertion_success": true,
      "model_tokens": null,
      "scripted_actions": 2,
      "observation_bytes": 49209,
      "wall_ms": 15.211,
      "capture_ms": 13.138,
      "artifact": "save-contact-raw-ax-1.json"
    },
    {
      "task": "save-contact",
      "mode": "sightmap",
      "repetition": 1,
      "status": "completed",
      "scripted_assertion_success": true,
      "model_tokens": null,
      "scripted_actions": 2,
      "observation_bytes": 1922,
      "wall_ms": 16.33,
      "capture_ms": 15.277,
      "artifact": "save-contact-sightmap-1.json"
    },
    {
      "task": "save-contact",
      "mode": "sightkick",
      "repetition": 1,
      "status": "not_run",
      "reason": "adapter not implemented; no model trial performed",
      "scripted_assertion_success": null,
      "model_tokens": null,
      "scripted_actions": null,
      "observation_bytes": null,
      "wall_ms": null,
      "capture_ms": null
    },
    {
      "task": "save-contact",
      "mode": "stagehand-facade",
      "repetition": 1,
      "status": "not_run",
      "reason": "adapter not implemented; no model trial performed",
      "scripted_assertion_success": null,
      "model_tokens": null,
      "scripted_actions": null,
      "observation_bytes": null,
      "wall_ms": null,
      "capture_ms": null
    },
    {
      "task": "filter-select",
      "mode": "raw-ax",
      "repetition": 1,
      "status": "completed",
      "scripted_assertion_success": true,
      "model_tokens": null,
      "scripted_actions": 2,
      "observation_bytes": 47096,
      "wall_ms": 3.845,
      "capture_ms": 2.944,
      "artifact": "filter-select-raw-ax-1.json"
    },
    {
      "task": "filter-select",
      "mode": "sightmap",
      "repetition": 1,
      "status": "completed",
      "scripted_assertion_success": true,
      "model_tokens": null,
      "scripted_actions": 2,
      "observation_bytes": 1786,
      "wall_ms": 13.958,
      "capture_ms": 13.244,
      "artifact": "filter-select-sightmap-1.json"
    },
    {
      "task": "filter-select",
      "mode": "sightkick",
      "repetition": 1,
      "status": "not_run",
      "reason": "adapter not implemented; no model trial performed",
      "scripted_assertion_success": null,
      "model_tokens": null,
      "scripted_actions": null,
      "observation_bytes": null,
      "wall_ms": null,
      "capture_ms": null
    },
    {
      "task": "filter-select",
      "mode": "stagehand-facade",
      "repetition": 1,
      "status": "not_run",
      "reason": "adapter not implemented; no model trial performed",
      "scripted_assertion_success": null,
      "model_tokens": null,
      "scripted_actions": null,
      "observation_bytes": null,
      "wall_ms": null,
      "capture_ms": null
    },
    {
      "task": "open-report",
      "mode": "raw-ax",
      "repetition": 1,
      "status": "completed",
      "scripted_assertion_success": true,
      "model_tokens": null,
      "scripted_actions": 1,
      "observation_bytes": 24431,
      "wall_ms": 24.819,
      "capture_ms": 1.803,
      "artifact": "open-report-raw-ax-1.json"
    },
    {
      "task": "open-report",
      "mode": "sightmap",
      "repetition": 1,
      "status": "completed",
      "scripted_assertion_success": true,
      "model_tokens": null,
      "scripted_actions": 1,
      "observation_bytes": 955,
      "wall_ms": 29.854,
      "capture_ms": 8.556,
      "artifact": "open-report-sightmap-1.json"
    },
    {
      "task": "open-report",
      "mode": "sightkick",
      "repetition": 1,
      "status": "not_run",
      "reason": "adapter not implemented; no model trial performed",
      "scripted_assertion_success": null,
      "model_tokens": null,
      "scripted_actions": null,
      "observation_bytes": null,
      "wall_ms": null,
      "capture_ms": null
    },
    {
      "task": "open-report",
      "mode": "stagehand-facade",
      "repetition": 1,
      "status": "not_run",
      "reason": "adapter not implemented; no model trial performed",
      "scripted_assertion_success": null,
      "model_tokens": null,
      "scripted_actions": null,
      "observation_bytes": null,
      "wall_ms": null,
      "capture_ms": null
    },
    {
      "task": "save-contact",
      "mode": "sightmap",
      "repetition": 2,
      "status": "completed",
      "scripted_assertion_success": true,
      "model_tokens": null,
      "scripted_actions": 2,
      "observation_bytes": 1922,
      "wall_ms": 16.617,
      "capture_ms": 15.047999999999998,
      "artifact": "save-contact-sightmap-2.json"
    },
    {
      "task": "save-contact",
      "mode": "raw-ax",
      "repetition": 2,
      "status": "completed",
      "scripted_assertion_success": true,
      "model_tokens": null,
      "scripted_actions": 2,
      "observation_bytes": 49618,
      "wall_ms": 10.077,
      "capture_ms": 8.548,
      "artifact": "save-contact-raw-ax-2.json"
    },
    {
      "task": "save-contact",
      "mode": "sightkick",
      "repetition": 2,
      "status": "not_run",
      "reason": "adapter not implemented; no model trial performed",
      "scripted_assertion_success": null,
      "model_tokens": null,
      "scripted_actions": null,
      "observation_bytes": null,
      "wall_ms": null,
      "capture_ms": null
    },
    {
      "task": "save-contact",
      "mode": "stagehand-facade",
      "repetition": 2,
      "status": "not_run",
      "reason": "adapter not implemented; no model trial performed",
      "scripted_assertion_success": null,
      "model_tokens": null,
      "scripted_actions": null,
      "observation_bytes": null,
      "wall_ms": null,
      "capture_ms": null
    },
    {
      "task": "filter-select",
      "mode": "sightmap",
      "repetition": 2,
      "status": "completed",
      "scripted_assertion_success": true,
      "model_tokens": null,
      "scripted_actions": 2,
      "observation_bytes": 1786,
      "wall_ms": 15.445,
      "capture_ms": 14.657,
      "artifact": "filter-select-sightmap-2.json"
    },
    {
      "task": "filter-select",
      "mode": "raw-ax",
      "repetition": 2,
      "status": "completed",
      "scripted_assertion_success": true,
      "model_tokens": null,
      "scripted_actions": 2,
      "observation_bytes": 47096,
      "wall_ms": 5.4,
      "capture_ms": 4.5920000000000005,
      "artifact": "filter-select-raw-ax-2.json"
    },
    {
      "task": "filter-select",
      "mode": "sightkick",
      "repetition": 2,
      "status": "not_run",
      "reason": "adapter not implemented; no model trial performed",
      "scripted_assertion_success": null,
      "model_tokens": null,
      "scripted_actions": null,
      "observation_bytes": null,
      "wall_ms": null,
      "capture_ms": null
    },
    {
      "task": "filter-select",
      "mode": "stagehand-facade",
      "repetition": 2,
      "status": "not_run",
      "reason": "adapter not implemented; no model trial performed",
      "scripted_assertion_success": null,
      "model_tokens": null,
      "scripted_actions": null,
      "observation_bytes": null,
      "wall_ms": null,
      "capture_ms": null
    },
    {
      "task": "open-report",
      "mode": "sightmap",
      "repetition": 2,
      "status": "completed",
      "scripted_assertion_success": true,
      "model_tokens": null,
      "scripted_actions": 1,
      "observation_bytes": 955,